{"additions":[{"reason":"Add the Apple design-source overlay contract.","target":{"mode":420,"package":"apple","path":"skills/apple-design-source/SKILL.md","sha256":"3b0504cfd149148dcd8de16e4385309c9fee72ce764b398373589bfa294ba8a2"}},{"reason":"Add the Apple design-source routing interface.","target":{"mode":420,"package":"apple","path":"skills/apple-design-source/agents/openai.yaml","sha256":"9ea26518eaf26928b134e2e0f9de34180b938b8202a518165ed2e2866ee0c142"}},{"reason":"Add the shared Canonical UI IR base compiler contract.","target":{"mode":420,"package":"design","path":"skills/design-ir-compiler/SKILL.md","sha256":"753c178f9ae6c79c94ff06e267f00ae490931fb62b8252b609ec5226c8495802"}},{"reason":"Add the shared Canonical UI IR compiler interface.","target":{"mode":420,"package":"design","path":"skills/design-ir-compiler/agents/openai.yaml","sha256":"5b29cfe24c770ea13765153a4d59184297b862bb4960b0f3b35c4a90f71c05bb"}},{"reason":"Add the shared platform-neutral Canonical UI IR base schema.","target":{"mode":420,"package":"design","path":"skills/design-ir-compiler/references/canonical-ui-ir-base-v1.schema.json","sha256":"ee17eb6a48791c5134da11cfdf27a8f3f00bea6bbfd1855fd5fbb32ccf873534"}}],"content_sha256":"51b62935b02f3606a328a7c894b070598a49cd5501d8e83581e2f526b55ccd02","entries":[{"disposition":"retained","reason":null,"source_path":"config/claude-code/agents/README.md","targets":[{"mode":420,"package":"apple","path":"config/claude-code/agents/README.md","sha256":"5fb572da227ec7b2a80964a27886cbb02c5d411e124d1a025ce7fa8302b851a4"}]},{"disposition":"retained","reason":null,"source_path":"config/claude-code/agents/builder.md","targets":[{"mode":420,"package":"apple","path":"config/claude-code/agents/builder.md","sha256":"457c01096663e166bf04137b6a982c509c60b21dccb0f9853df1ad6af44270c5"}]},{"disposition":"retained","reason":null,"source_path":"config/claude-code/agents/docs_researcher.md","targets":[{"mode":420,"package":"apple","path":"config/claude-code/agents/docs_researcher.md","sha256":"af0df2b758a409688cc758dc244dbd4426e7b49420f034ff932361c35e8b49e0"}]},{"disposition":"relocated","reason":null,"source_path":"config/claude-code/agents/explorer.md","targets":[{"mode":420,"package":"workflow","path":"assets/claude-code/agents/explorer.md","sha256":"eda0fb0d5083815eb0cfb84fd33e3eacf49bd7afd8f515e3fb0845be4a72656c"}]},{"disposition":"retained","reason":null,"source_path":"config/claude-code/agents/orchestration.md","targets":[{"mode":420,"package":"apple","path":"config/claude-code/agents/orchestration.md","sha256":"435f13fd17def87df5dd13934f0b91595252279998619149157caccc7dfd47c1"}]},{"disposition":"relocated","reason":null,"source_path":"config/claude-code/agents/pm.md","targets":[{"mode":420,"package":"workflow","path":"assets/claude-code/agents/pm.md","sha256":"65b18d24d57c66071a3487ee443897d426044d5cd5e16d5e36c27d4421bb6e45"}]},{"disposition":"relocated","reason":null,"source_path":"config/claude-code/agents/reporter.md","targets":[{"mode":420,"package":"workflow","path":"assets/claude-code/agents/reporter.md","sha256":"175f3f95981ca18486b40e24464f8c708a336b3730107c8b044c5381310c70ba"}]},{"disposition":"transformed","reason":"Remove Apple-specific routing from the shared agent template and delegate platform checks to the selected platform extension.","source_path":"config/claude-code/agents/reviewer.md","targets":[{"mode":420,"package":"review","path":"assets/claude-code/agents/reviewer.md","sha256":"fb5de85abd2416bea50e98640b6e6feb1b57fbfb5c8fb033e6fca81adcafa21a"}]},{"disposition":"retained","reason":null,"source_path":"config/claude-code/agents/tester.md","targets":[{"mode":420,"package":"apple","path":"config/claude-code/agents/tester.md","sha256":"588aea594c277428202f5e67ade8b3a24cc02b9825e6cb313b997f71c4c704bf"}]},{"disposition":"retained","reason":null,"source_path":"config/claude-code/memory-seed.md","targets":[{"mode":420,"package":"apple","path":"config/claude-code/memory-seed.md","sha256":"04bcdeeb426715d13abe05348f28049f24aa71e44304f27a95607209f3553a24"}]},{"disposition":"retained","reason":null,"source_path":"config/claude-code/settings.json","targets":[{"mode":420,"package":"apple","path":"config/claude-code/settings.json","sha256":"045625a6d59a5c193442154d74617b6dd2d1582e41fb3b2115f89195e737ea8f"}]},{"disposition":"removed","reason":"Local machine overrides must never be distributed by a platform package.","source_path":"config/claude-code/settings.local.json","targets":[]},{"disposition":"relocated","reason":"Move generic Codex shared configuration into an explicitly selected runtime-config package.","source_path":"config/codex/codex.shared.toml","targets":[{"mode":420,"package":"codex","path":"assets/codex/codex.shared.toml","sha256":"53ccce922dcc671573c8c04afeef64155ed070cd4aa91c76c00e903ee3b35862"}]},{"disposition":"retained","reason":null,"source_path":"config/codex/templates/agents/README.md","targets":[{"mode":420,"package":"apple","path":"config/codex/templates/agents/README.md","sha256":"17dc334baebc3e57cecf28ecda17ed9de27b61df9ee928de0e8120365bc71617"}]},{"disposition":"retained","reason":null,"source_path":"config/codex/templates/agents/builder.toml","targets":[{"mode":420,"package":"apple","path":"config/codex/templates/agents/builder.toml","sha256":"61f7d0629bc17df5e62cb22e1aef617218dc132c03a97c7d4e310f60a8a01c30"}]},{"disposition":"relocated","reason":"Relocate the cross-platform design researcher template into the shared design discipline.","source_path":"config/codex/templates/agents/design_researcher.toml","targets":[{"mode":420,"package":"design","path":"assets/codex/agents/design_researcher.toml","sha256":"6c381d098509788811568933188de8c78da69a16420cf91640d52330845a05f8"}]},{"disposition":"retained","reason":null,"source_path":"config/codex/templates/agents/docs_researcher.toml","targets":[{"mode":420,"package":"apple","path":"config/codex/templates/agents/docs_researcher.toml","sha256":"db41834b60fe3af4954d67aea77847db1f676f598716fe11834ab0bfb1201a1a"}]},{"disposition":"relocated","reason":null,"source_path":"config/codex/templates/agents/explorer.toml","targets":[{"mode":420,"package":"workflow","path":"assets/codex/agents/explorer.toml","sha256":"5f00697e6c7332f3958a3bdc29d60e2879a4c370cb0ebb9b36d79fe57d3b7db8"}]},{"disposition":"transformed","reason":"Remove Apple-specific routing from the shared agent template and delegate platform checks to the selected platform extension.","source_path":"config/codex/templates/agents/pm.toml","targets":[{"mode":420,"package":"workflow","path":"assets/codex/agents/pm.toml","sha256":"d8c2572d9e54f6f63cf68087e7785af133b0d4bf870f518ae68927b21db0bca9"}]},{"disposition":"relocated","reason":null,"source_path":"config/codex/templates/agents/reporter.toml","targets":[{"mode":420,"package":"workflow","path":"assets/codex/agents/reporter.toml","sha256":"16b385d63e1a27e3d05d303d99197fa6c8f0f9119b0270a8c0c6ee56f721f7c9"}]},{"disposition":"transformed","reason":"Remove Apple-specific routing from the shared agent template and delegate platform checks to the selected platform extension.","source_path":"config/codex/templates/agents/reviewer.toml","targets":[{"mode":420,"package":"review","path":"assets/codex/agents/reviewer.toml","sha256":"cdc626ca61f1b1b6d1673606274273351ba822ad96fb02c1978ffe7bc3cefd0f"}]},{"disposition":"retained","reason":null,"source_path":"config/codex/templates/agents/tester.toml","targets":[{"mode":420,"package":"apple","path":"config/codex/templates/agents/tester.toml","sha256":"23f37de96db1b1b36349366bb5110abd22ea9e1ee68ce24b5ced2f9615b3f225"}]},{"disposition":"retained","reason":null,"source_path":"config/codex/templates/codex_verify.example.sh","targets":[{"mode":493,"package":"apple","path":"config/codex/templates/codex_verify.example.sh","sha256":"bf11570b46274f81f0ddd0ed6cdcc99f9b86dd47244a78d82975c790e9039c9d"}]},{"disposition":"relocated","reason":"Move generic Codex profile templates into an explicitly selected runtime-config package.","source_path":"config/codex/templates/profiles/README.md","targets":[{"mode":420,"package":"codex","path":"assets/codex/profiles/README.md","sha256":"32280d368ff9459fcf28fbbca09da384fa7af463fcc78ff13dcd16ec5edb8ef7"}]},{"disposition":"relocated","reason":"Move generic Codex profile templates into an explicitly selected runtime-config package.","source_path":"config/codex/templates/profiles/budget.config.toml","targets":[{"mode":420,"package":"codex","path":"assets/codex/profiles/budget.config.toml","sha256":"7bb6dc4e8fa83b6a672ceedf01317929cd393bbbb1956af54a0064adfb790c76"}]},{"disposition":"relocated","reason":"Move generic Codex profile templates into an explicitly selected runtime-config package.","source_path":"config/codex/templates/profiles/daily.config.toml","targets":[{"mode":420,"package":"codex","path":"assets/codex/profiles/daily.config.toml","sha256":"9bd2a263de6863bc7441243190d0ec00c4cac6146e1ea6c9285e36a23aeaf72e"}]},{"disposition":"relocated","reason":"Move generic Codex profile templates into an explicitly selected runtime-config package.","source_path":"config/codex/templates/profiles/deep.config.toml","targets":[{"mode":420,"package":"codex","path":"assets/codex/profiles/deep.config.toml","sha256":"c2ab809b6194683b5e72211d2c1b16cbae5e9dd91619873293768d541cdbbc11"}]},{"disposition":"relocated","reason":"Move generic Codex profile templates into an explicitly selected runtime-config package.","source_path":"config/codex/templates/profiles/extreme.config.toml","targets":[{"mode":420,"package":"codex","path":"assets/codex/profiles/extreme.config.toml","sha256":"1fd0167ba567888328236cb6a380ab5963d090e7ee0e2cee63fe6bb3fd24ddbb"}]},{"disposition":"relocated","reason":"Move generic Codex profile templates into an explicitly selected runtime-config package.","source_path":"config/codex/templates/profiles/interactive-fast.config.toml","targets":[{"mode":420,"package":"codex","path":"assets/codex/profiles/interactive-fast.config.toml","sha256":"ce03f3b1b1c8dbf949962d992898ab4a1df